filename,topic,topic_name
A Comprehensive Review on Microalgae-Based Biorefinery as Two-Way Source of Wastewater Treatment and Bioresource Recovery.pdf,1,1_the_of_and_in
A comprehensive review on the advances of bioproducts from biomass        towards meeting net zero carbon emissions (NZCE)..pdf,3,3_the_of_and_in
A conceptual review on microalgae biorefinery through thermochemical and biological pathways Bio-circular approach on carbon capture and wastewater treatment.pdf,1,1_the_of_and_in
A critical review on life cycle analysis of algae biodiesel current challenges and future prospects.pdf,0,0_the_of_and_in
A Holistic Approach to Circular Bioeconomy Through the Sustainable Utilization of Microalgal Biomass for Biofuel and Other Value-Added Products.pdf,5,5_of_and_the_in
A Microalgae-Based Biodiesel Refinery  Sustainability Concerns and Challenges.pdf,4,4_the_of_and_biodiesel
A review of the sustainability of algal-based biorefineries Towards an integrated assessment framework.pdf,0,0_the_of_and_in
A review on microalgae biofuel and biorefinery  challenges and way forward.pdf,0,0_the_of_and_in
A review on the current status and post-pandemic prospects of third-generation biofuels.pdf,2,2_and_of_the_in
"A state of the art review on the cultivation of algae for energy and other valuable products application, challenges, and opportunities..pdf",3,3_the_of_and_in
A systematic review on biofuel production and utilization from algae and waste feedstocks a circular economy approach.pdf,3,3_the_of_and_in
Advancements and Prospects in Algal Biofuel Production A Comprehensive Review.pdf,2,2_and_of_the_in
Advancements in sustainable production of biofuel by microalgae  Recent insights and future directions.pdf,2,2_and_of_the_in
Advances and perspectives in using microalgae to produce biodiesel.pdf,4,4_the_of_and_biodiesel
"Advances in attached growth microalgae cultivation for third-generation biofuel production opportunities, challenges, and future prospect.pdf",5,5_of_and_the_in
"Agro-industrial wastewaters for algal biomass production, bio-based        products, and biofuels in a circular bioeconomy..pdf",1,1_the_of_and_in
"Algae and their potential for a future bioeconomy, landless food        production, and the socio-economic impact of an algae industry..pdf",2,2_and_of_the_in
"Algae as a source of renewable energy opportunities, challenges, and recent developments.pdf",2,2_and_of_the_in
Algae-based bioenergy production aligns with the Paris agreement goals as a carbon mitigation technology.pdf,3,3_the_of_and_in
"Algal bioenergy production and utilization Technologies, challenges, and prospects.pdf",2,2_and_of_the_in
Algal biofuel production and mitigation potential in India.pdf,2,2_and_of_the_in
Algal biofuels in Canada Status and potential.pdf,2,2_and_of_the_in
Algal biomass valorization for biofuel production and carbon sequestration a review.pdf,2,2_and_of_the_in
Algal bioplastics current market trends and technical aspects.pdf,2,2_and_of_the_in
Algal biorefinery a potential solution to the food-energy-water-environment nexus.pdf,1,1_the_of_and_in
Algal biorefinery An integrated approach for sustainable biodiesel production.pdf,4,4_the_of_and_biodiesel
"Algal-Based Carbonaceous Materials for Environmental Remediation  Advances in Wastewater Treatment, Carbon Sequestration, and Biofuel Applications.pdf",1,1_the_of_and_in
Aligning sustainable aviation fuel research with sustainable development goals Trends and thematic analysis.pdf,0,0_the_of_and_in
An economic and technical evaluation of microalgal biofuels.pdf,2,2_and_of_the_in
An integrated approach of algae-bacteria mediated treatment of industries generated wastewater optimal recycling of water and safe way        of resource recovery.pdf,1,1_the_of_and_in
An outlook on microalgal biofuels.pdf,5,5_of_and_the_in
An overview on microalgae as renewable resources for meeting sustainable development goals.pdf,3,3_the_of_and_in
Anaerobic digestate as a low-cost nutrient source for sustainable  microalgae cultivation a way forward through waste valorization   approach.pdf,3,3_the_of_and_in
Anaerobic digestion of microalgae as a necessary step to make microalgal biodiesel sustainable.pdf,0,0_the_of_and_in
"Anaerobic digestion of microalgal biomass Challenges, opportunities and research needs.pdf",1,1_the_of_and_in
Analysis of the limiting factors for large scale microalgal cultivation a promising future for renewable and sustainable biofuel industry..pdf,4,4_the_of_and_biodiesel
"Application of Microalgae to Wastewater Bioremediation, with CO2 Biomitigation, Health Product and Biofuel Development, and Environmental Biomonitoring.pdf",1,1_the_of_and_in
Application of microbial resources in biorefineries current trend and future prospects.pdf,0,0_the_of_and_in
Assessing global carbon sequestration and bioenergy potential from microalgae cultivation on marginal lands leveraging machine learning.pdf,0,0_the_of_and_in
Aviation fuel based on wastewater-grown microalgae Challenges and opportunities of hydrothermal liquefaction and hydrotreatment.pdf,0,0_the_of_and_in
Bibliometric insights into microalgae cultivation in wastewater trends        and future prospects for biolipid production and environmental        sustainability.pdf,1,1_the_of_and_in
Bio-mitigation of carbon dioxide using microalgal systems Advances and perspectives.pdf,1,1_the_of_and_in
Bio-processing of algal bio-refinery  a review on current advances and future perspectives.pdf,2,2_and_of_the_in
Biofuel from microalgae Sustainable pathways.pdf,3,3_the_of_and_in
Biofuel policy in India A review of policy barriers in sustainable marketing of biofuel.pdf,3,3_the_of_and_in
Biofuel production from microalgae challenges and chances.pdf,0,0_the_of_and_in
"Biofuel Production Using Cultivated Algae Technologies, Economics, and Its Environmental Impacts.pdf",3,3_the_of_and_in
"Biogas from microalgae Technologies, challenges and opportunities.pdf",0,0_the_of_and_in
"Bioproducts from microalgae biomass Technology, sustainability, challenges and opportunities.pdf",0,0_the_of_and_in
Biotechnological perspectives on algae a viable option for next generation biofuels..pdf,2,2_and_of_the_in
Biotreatment of Industrial Wastewater using Microalgae A Tool for a Sustainable Bioeconomy.pdf,1,1_the_of_and_in
Challenges and opportunities for microalgae-mediated CO2capture and biorefinery.pdf,1,1_the_of_and_in
Challenges and opportunities in application of microalgae (Chlorophyta) for wastewater treatment a review.pdf,1,1_the_of_and_in
Closed loop bioeconomy opportunities through the integration of microalgae cultivation with anaerobic digestion A critical review.pdf,0,0_the_of_and_in
CO2 mitigation and phycoremediation of industrial flue gas and wastewater via microalgae-bacteria consortium possibilities and challenges..pdf,3,3_the_of_and_in
Commercialization potential of microalgae for biofuels production.pdf,0,0_the_of_and_in
"Comprehensive insights into conversion of microalgae to feed, food, and biofuels Current status and key challenges towards implementation of sustainable biorefineries.pdf",3,3_the_of_and_in
Consequential analysis of algal biofuels benefits to ocean resources.pdf,0,0_the_of_and_in
Continuous cultivation of microalgae in photobioreactors as a source of renewable energy Current status and future challenges.pdf,3,3_the_of_and_in
Coupling bioremediation and biorefinery prospects of microalgae for circular economy.pdf,0,0_the_of_and_in
Cultivation and Processing of Microalgae for Its Sustainability as a Feedstock for Biodiesel Production.pdf,4,4_the_of_and_biodiesel
Cultivation in wastewaters for energy A microalgae platform.pdf,1,1_the_of_and_in
Current and Future Perspective of Microalgae for Simultaneous Wastewater Treatment and Feedstock for Biofuels Production.pdf,1,1_the_of_and_in
Current Bottlenecks and Challenges of the Microalgal Biorefinery.pdf,5,5_of_and_the_in
Current Issues and Developments in Cyanobacteria-Derived Biofuel as a Potential Source of Energy for Sustainable Future.pdf,3,3_the_of_and_in
Current research and perspectives on microalgae-derived biodiesel.pdf,4,4_the_of_and_biodiesel
Current Status and Challenges of Microalgae as an Eco-Friendly Biofuel Feedstock A Review.pdf,0,0_the_of_and_in
Current trends and prospects in microalgae-based bioenergy production.pdf,2,2_and_of_the_in
Current trends in biodiesel production technologies and future progressions A possible displacement of the petro-diesel.pdf,4,4_the_of_and_biodiesel
Development of Microalgae Biodiesel Current Status and Perspectives.pdf,4,4_the_of_and_biodiesel
Developments and challenges in biodiesel production from microalgae A review.pdf,4,4_the_of_and_biodiesel
Dual potential of microalgae as a sustainable biofuel feedstock and animal feed.pdf,5,5_of_and_the_in
Enhancing sustainability  microalgae cultivation for biogas enrichment and phycoremediation of palm oil mill effluent - a comprehensive review.pdf,0,0_the_of_and_in
Environmental life cycle assessment of algae systems Critical review of modelling approaches.pdf,0,0_the_of_and_in
Expanding the microalgal industry - continuing controversy or compelling case.pdf,2,2_and_of_the_in
Exploiting outcomes of life cycle costing to conduct coherent screening social life cycle assessments of emerging systems a case study of microalgae biorefineries.pdf,0,0_the_of_and_in
Exploring the potential of microalgae cell factories for generation of biofuels.pdf,0,0_the_of_and_in
Feasibility of microalgae as feedstock for alternative fuel in Malaysia A review.pdf,4,4_the_of_and_biodiesel
Fourth generation biofuel a review on risks and mitigation strategies.pdf,3,3_the_of_and_in
Harnessing microalgae Innovations for achieving UN Sustainable Development Goals and climate resilience.pdf,1,1_the_of_and_in
Insights into the potential impact of algae-mediated wastewater  beneficiation for the circular bioeconomy a global perspective..pdf,1,1_the_of_and_in
"Integrated CO2 capture, wastewater treatment and biofuel production by microalgae culturing - A review.pdf",1,1_the_of_and_in
Integrated marine biogas a promising approach towards sustainability.pdf,3,3_the_of_and_in
Integration of microalgae cultivation with industrial waste remediation for biofuel and bioenergy production opportunities and limitations.pdf,0,0_the_of_and_in
Integration of microalgae production with industrial biofuel facilities A critical review.pdf,0,0_the_of_and_in
Large Scale Microalgae Biofuel Technology Development Perspectives in Light of the Barriers and Limitations.pdf,0,0_the_of_and_in
Life cycle assessment of green diesel production from microalgae.pdf,0,0_the_of_and_in
Life Cycle Based GHG Emissions from Algae Based Bioenergy with a Special Emphasis on Climate Change Indicators and Their Uses in Dynamic LCA A Review.pdf,0,0_the_of_and_in
Lignocellulosic biorefinery as a model for sustainable development of biofuels and value added products.pdf,0,0_the_of_and_in
Marine microalgae contribution to sustainable development.pdf,1,1_the_of_and_in
Marine microalgae for production of biofuels and chemicals.pdf,2,2_and_of_the_in
Mass cultivation and harvesting of microalgal biomass current trends and future perspectives.pdf,5,5_of_and_the_in
Mechanism and challenges in commercialisation of algal biofuels.pdf,2,2_and_of_the_in
"Micro-algae cultivation for biofuels Cost, energy balance, environmental impacts and future prospects.pdf",2,2_and_of_the_in
Microalgae  a robust  green bio-bridge  between energy and environment.pdf,0,0_the_of_and_in
Microalgae A green multi-product biorefinery for future industrial prospects.pdf,0,0_the_of_and_in
Microalgae a promising source for biofuel production.pdf,3,3_the_of_and_in
Microalgae An alternative as sustainable source of biofuels.pdf,0,0_the_of_and_in
Microalgae and biofuels A promising partnership.pdf,5,5_of_and_the_in
Microalgae and circular economy unlocking waste to resource pathways for sustainable development.pdf,0,0_the_of_and_in
Microalgae as A Potential Feedstock for Biodiesel Production in The Philippines A Review.pdf,4,4_the_of_and_biodiesel
Microalgae as a solution of third world energy crisis for biofuels production from wastewater toward carbon neutrality An updated review.pdf,1,1_the_of_and_in
Microalgae as a sustainable energy source for biodiesel production A review.pdf,4,4_the_of_and_biodiesel
Microalgae as tools for bio-circular-green economy Zero-waste approaches for sustainable production and biorefineries of microalgal biomass.pdf,3,3_the_of_and_in
Microalgae based biorefinery promoting circular bioeconomy-techno economic and life-cycle analysis.pdf,0,0_the_of_and_in
Microalgae Bioenergy with Carbon Capture and Storage (BECCS) An emerging sustainable bioprocess for reduced CO2 emission and biofuel production.pdf,1,1_the_of_and_in
"Microalgae biofuels A critical review of issues, problems and the way forward.pdf",0,0_the_of_and_in
Microalgae biofuels as an alternative to fossil fuel for power generation.pdf,0,0_the_of_and_in
Microalgae biofuels illuminating the path to a sustainable future amidst challenges and opportunities.pdf,5,5_of_and_the_in
Microalgae biofuels production A systematic review on socioeconomic prospects of microalgae biofuels and policy implications.pdf,2,2_and_of_the_in
Microalgae biomass production for a biorefinery system Recent advances and the way towards sustainability.pdf,0,0_the_of_and_in
Microalgae Biomass Production for Biofuels in Brazilian Scenario  A Critical Review.pdf,1,1_the_of_and_in
Microalgae biorefinery  An integrated route for the sustainable production of high-value-added products.pdf,3,3_the_of_and_in
Microalgae biorefinery alternatives and hazard evaluation.pdf,4,4_the_of_and_biodiesel
Microalgae fast-growth sustainable green factories.pdf,0,0_the_of_and_in
"Microalgae for biofuels, wastewater treatment and environmental monitoring.pdf",1,1_the_of_and_in
"Microalgae for Sustainable Biofuel Generation Innovations, Bottlenecks, and Future Directions.pdf",2,2_and_of_the_in
Microalgae in a global world New solutions for old problems.pdf,1,1_the_of_and_in
Microalgae potential and multiple roles - current progress and future  prospects - an overview.pdf,0,0_the_of_and_in
Microalgae production as a biofuel feedstock Risks and challenges.pdf,0,0_the_of_and_in
Microalgae-based biodiesel production and its challenges and future opportunities A review.pdf,4,4_the_of_and_biodiesel
Microalgal Biodiesel A Challenging Route toward a Sustainable Aviation Fuel.pdf,4,4_the_of_and_biodiesel
Microalgal biodiesel in China Opportunities and challenges.pdf,4,4_the_of_and_biodiesel
Microalgal Biodiesel Production  Realizing the Sustainability Index.pdf,4,4_the_of_and_biodiesel
Microalgal Bioeconomy A Green Economy Approach Towards Achieving Sustainable Development Goals.pdf,0,0_the_of_and_in
Microalgal bioenergy production under zero-waste biorefinery approach Recent advances and future perspectives.pdf,0,0_the_of_and_in
Microalgal biofuel production Potential challenges and prospective research.pdf,3,3_the_of_and_in
Microalgal Biorefineries for Bioenergy Production Can We Move from Concept to Industrial Reality.pdf,0,0_the_of_and_in
Microalgal Co-cultivation for Biofuel Production and Bioremediation Current Status and Benefits.pdf,5,5_of_and_the_in
Microalgal cultivation with biogas slurry for biofuel production.pdf,2,2_and_of_the_in
Microalgal drying and cell disruption - recent advances..pdf,2,2_and_of_the_in
Microalgal industry in China challenges and prospects..pdf,5,5_of_and_the_in
Microalgal systems for wastewater treatment technological trends and    challenges towards waste recovery..pdf,1,1_the_of_and_in
"Microalgal-Based Bioenergy Strategies, Prospects, and Sustainability.pdf",0,0_the_of_and_in
Multifaceted Role of Microalgae for Municipal Wastewater Treatment A Futuristic Outlook toward Wastewater Management.pdf,1,1_the_of_and_in
"Optimal design of microalgae-based biorefinery Economics, opportunities and challenges.pdf",0,0_the_of_and_in
Overview of Carbon Capture Technology Microalgal Biorefinery Concept and State-of-the-Art.pdf,1,1_the_of_and_in
Overview of CO2bioconversion into third-generation (3G) bioethanol - a patent-based scenario..pdf,1,1_the_of_and_in
Paradigm shift in algal biomass refinery and its challenges..pdf,2,2_and_of_the_in
Perspectives and challenges of small scale plant microalgae cultivation. Evidences from Southern Italy.pdf,2,2_and_of_the_in
Perspectives of microalgal biofuels as a renewable source of energy.pdf,0,0_the_of_and_in
Photobiological effects of converting biomass into hydrogen - challenges        and prospects..pdf,3,3_the_of_and_in
"Photosynthetic green hydrogen Advances, challenges, opportunities, and prospects.pdf",3,3_the_of_and_in
Potential of microalgal biodiesel production and its sustainability perspectives in Pakistan.pdf,4,4_the_of_and_biodiesel
Potential of microalgal bioproducts general perspectives and main        challenges..pdf,5,5_of_and_the_in
Potential use of saline resources for biofuel production using        halophytes and marine algae prospects and pitfalls..pdf,2,2_and_of_the_in
Progress of microalgae biofuel's commercialization.pdf,5,5_of_and_the_in
Prospects of using microalgae for biofuels production Results of a Delphi study.pdf,0,0_the_of_and_in
Realization process of microalgal biorefinery The optional approach toward carbon net-zero emission.pdf,1,1_the_of_and_in
Recent advances in biodiesel production from agricultural products and        microalgae using ionic liquids opportunities and challenges..pdf,3,3_the_of_and_in
Recent advances in the integrated biorefinery concept for the valorization of algal biomass through sustainable routes.pdf,2,2_and_of_the_in
Recent advances in wastewater microalgae-based biofuels production A state-of-the-art review.pdf,3,3_the_of_and_in
Stakeholder perceptions of biofuels from microalgae.pdf,2,2_and_of_the_in
Strategies and challenges to enhance commercial viability of algal        biorefineries for biofuel production..pdf,3,3_the_of_and_in
Sustainability and carbon neutralization trends in microalgae bioenergy production from wastewater treatment A review.pdf,1,1_the_of_and_in
Sustainability and economic evaluation of microalgae grown in brewery        wastewater..pdf,0,0_the_of_and_in
Sustainability assessment of combined animal fodder and fuel production        from microalgal biomass..pdf,0,0_the_of_and_in
Sustainability considerations of biodiesel based on supply chain        analysis..pdf,4,4_the_of_and_biodiesel
Sustainability index analysis of microalgae cultivation from biorefinery palm oil mill effluent.pdf,0,0_the_of_and_in
Sustainability metrics on microalgae-based wastewater treatment system..pdf,1,1_the_of_and_in
Sustainability of direct biodiesel synthesis from microalgae biomass A critical review.pdf,4,4_the_of_and_biodiesel
"Sustainable algal biorefinery a review on current perspective on technical maturity, supply infrastructure, business and industrial opportunities..pdf",2,2_and_of_the_in
Sustainable biofuels from algae.pdf,2,2_and_of_the_in
Sustainable energy harnessing Microalgae as a potential biofuel source and carbon sequestration solution.pdf,0,0_the_of_and_in
Sustainable energy transitions Evaluating microalgal biodiesel feedstocks using multi-criteria decision making techniques.pdf,4,4_the_of_and_biodiesel
"Sustainable hydrogen production via microalgae technological        advancements, economic indicators, environmental aspects, challenges,        and policy implications..pdf",0,0_the_of_and_in
System integration for producing microalgae as biofuel feedstock.pdf,5,5_of_and_the_in
The Analysis on the Current Situation of the Utilization Mode of Microalgal Biomass Materials.pdf,1,1_the_of_and_in
The Contribution of Microalgae in Bio-refinery and Resource Recovery A Sustainable Approach leading to Circular Bioeconomy.pdf,0,0_the_of_and_in
The current state of algae in wastewater treatment and energy        conversion a critical review..pdf,1,1_the_of_and_in
The promise and challenges of microalgal-derived biofuels.pdf,2,2_and_of_the_in
The role of microalgae in the bioeconomy..pdf,2,2_and_of_the_in
The water-energy nexus at the hybrid bioenergy supply chain a        sustainable network design model..pdf,0,0_the_of_and_in
Third-generation biofuel supply chain A comprehensive review and future research directions.pdf,0,0_the_of_and_in
Towards a sustainable approach for development of biodiesel from plant and microalgae.pdf,4,4_the_of_and_biodiesel
Upcycling food waste into biorefinery production by microalgae.pdf,1,1_the_of_and_in
Using atmospheric emissions as CO2source in the cultivation of        microalgae productivity and economic viability..pdf,1,1_the_of_and_in
Using microalgae in the circular economy to valorise anaerobic        digestate challenges and opportunities..pdf,3,3_the_of_and_in
Valorisation of algal biomass to value-added metabolites emerging trends and opportunities.pdf,2,2_and_of_the_in
Valorization of abattoir water discharge through phycoremediation for        enhanced biomass and biodiesel production..pdf,1,1_the_of_and_in
Valorization of micro-algae biomass for the development of green biorefinery Perspectives on techno-economic analysis and the way towards sustainability.pdf,3,3_the_of_and_in
Valorization of microalgae biomass into bioproducts promoting circular bioeconomy a holistic approach of bioremediation and biorefinery.pdf,5,5_of_and_the_in
Wastewater and waste CO2 for sustainable biofuels from microalgae.pdf,0,0_the_of_and_in
Way forward to achieve sustainable and cost-effective biofuel production from microalgae a review.pdf,5,5_of_and_the_in
Zero-carbon solution Microalgae as a low-cost feedstock for fuel production and carbon sequestration.pdf,0,0_the_of_and_in
Zero-waste algal biorefinery for bioenergy and biochar A green leap towards achieving energy and environmental sustainability.pdf,0,0_the_of_and_in
